id,titles,au_category
1,"act on climate: steps to individual, community, and political action",public university
2,adaptation funding,un
3,administrative records quality assessment tool (hecra),government
4,air quality management,un
5,alianzas: un veh<ed>culo para lograr el desarrollo sostenible,finance
6,anti-corruption in the context of the 2030 agenda,"un, un"
7,beyond the sdgs (sdgs): addressing sustainability and development,public university
8,biosphere 2 science for the future of our planet,public university
9,book club with jeffrey sachs,"private university, private university"
10,calidad de registros administrativos,government
11,changingmindsets in public institutions to implement the 2030 agenda for sustainable development<u+200b>,un
12,circular economy and the 2030 agenda,"un, un, ngo, un"
13,cities and marine plastic pollution: building a circular economy,un
14,cities and the challenge of sustainable development,private university
15,civil registration and vital statistics systems,un
16,climate action: solutions for a changing planet,"private university, ngo, public university, public university, ngo, public university, business, government, un, research  policy institutes, government, research  policy institutes, research  policy institutes, public university"
17,climate adaptation in africa,public university
18,climate change and water in mountains: a global concern,public university
19,climate change mitigation in developing countries,"public university, public university"
20,climate change science & negotiations,"private university, ngo"
21,climate change: the science and global impact,public university
22,climate mitigation initiatives,un
23,communicating gender statistics,government
24,communicating statistics on women's economic empowerment,government
25,compilation and application of environmentally extended supply-use tables,un
26,constructing producer price indexes and import and export price indexes,government
27,conversations with global leaders: leading on sustainable development,"private university, business, government, government, un"
28,data planning with adapt,government
29,designing a multidimensional poverty index,"government, un"
30,digit4sd: digital government implementation,un
31,ecological and energy transitions in southern countries,public university
32,ecology: ecosystem dynamics and conservation,"cultural institution, ngo"
33,economic indicators,government
34,effective national to local public governance for sdg implementation,un
35,e-government for womens empowerment <u+200b>,un
36,el snieg de mxico,government
37,e-learning on gender statistics,un
38,e-learning series on public-private partnerships,un
39,ensuring womens legal rights to land ownership and/or control,un
40,environmental management & ethics,public university
41,environmental sdg indicators,"un, un"
42,environmental security and sustaining peace,"private university, private university, ngo, un, public university"
43,equip,un
44,essential reading and understanding dhs program tables,government
45,ethics in action,"private university, ngo"
46,e-training on gdp re-basing,un
47,e-training on gender statistics,un
48,e-training on the compilation and application of supply-use tables (suts) in afr,un
49,e-training on the framework for development of environmental statistics (fdes),un
50,evaluation of  public policies and programmes,government
51,extractive sector: sustainability and development in latin america and the caribbean,"private university, un ngo, un, finance"
52,feeding a hungry planet,"private university, private university, private university, private university, public university, business"
53,financing in health,un
54,fisheries and aquaculture statistics,un
55,follow-up and review (fur) and the voluntary national review (vnr),un
56,"foresight for development, the 2030 agenda and the sdgs","un, un"
57,"formation introductive sur la jeunesse, la paix et la scurit",un
58,from climate science to action,government
59,from the ground up: managing our terrestrial ecosystems,"private university, public university, un, ngo, public university"
60,frozen in the ice: exploring the arctic,public university
61,fundamental principles of the official statistics,government
62,geospatial information technology in fragile contexts,research  policy institutes
63,getting a good deal: negotiating extractive industry contracts,"government, ngo, private university, research  policy institutes"
64,global energy and climate policy,"public university, public university"
65,global environmental management,public university
66,global public health,"public university, research  policy institutes, private university, ngo"
67,global warming ii: create your own models in python,private university
68,globalization: past and future,"private university, un ngo"
69,governance for transboundary freshwater security,"government, government, public university, public university, research  policy institutes, un, public university, research  policy institutes, research  policy institutes, business"
70,government innovation for social inclusion of vulnerable groups,un
71,greening the economy: lessons from scandinavia,public university
72,how to achieve the sdgs,"private university, un"
73,"human rights, environmental protection and climate change",research  policy institutes
74,"human rights, human wrongs",public university
75,ilo labour market statistics and analysis academy,un
76,industrial policy in the 21st century: the challenge for africa,research  policy institutes
77,infrastructure asset management for sustainable development,"un, un"
78,"infrastructure, public-private partnerships, and fiscal management",un
79,innovation and digital government for public service delivery <u+200b>,un
80,integrated economic statistics to support 2008 sna implementation,"research  policy institutes, un"
81,integrated policies and policy coherence for sdgs,"un, un, un"
82,integrated policies and policy coherence for the sdgs,un
83,integrated recovery planning and policy coherence towards the sdgs,un
84,integrated recovery planning and policy coherence towards the sdgs,"un, un"
85,integrating climate risk information into naps,"un, un, un"
86,integration of the sdgs into national planning,un
87,international business alliance,un
88,international criminal law and transitional justice,"un, ngo"
89,international law in the 21st century,research  policy institutes
90,introduction to big data for sustainable development,research  policy institutes
91,introduction to data governance for monitoring the sdgs,un
92,introduction to environmental law and policy,public university
93,introduction to index insurance,un
94,introduction to standards and sustainability,un
95,introduction to sustainability,public university
96,introduction to sustainable development goal indicators under fao custodianship,un
97,introduction to the arctic: climate,public university
98,introduction to the seea central framework,un
99,introduction to the seea central framework,un
100,"introductory training on youth, peace and security",un
101,labor market information: business establishment surveys,government
102,labor market information: household labor force surveys,government
103,labour productivity and income of small-scale food producers,un
104,laudato si<u+0092>: on care for our common home,"private university, finance, cultural institution, cultural institution, ngo"
105,law of international organizations  extended edition,un
106,law of treaties  extended edition,un
107,leip,"un, un"
108,living heritage and sustainable development,"private university, private university, public university, public university, public university, public university, cultural institution, ngo, public university, un, public university"
109,m.a. development studies and diplomacy,"un, un"
110,m.a. in international law and diplomacy,"un, un"
111,ma development studies and diplomacy,"un, un"
112,machine learning on satellite imagery,research  policy institutes
113,macroeconomics for a sustainable planet,"private university, government"
114,"manual bsico sobre la juventud, la paz y la seguridad",un
115,master in anti-corruption and diplomacy,research  policy institutes
116,master in international affairs and diplomacy,un
117,measuring productivity,government
118,measuring sustainable development,un ngo
119,measuring sustainable development,"un ngo, ngo"
120,national disaster risk reduction strategies,un
121,national metadata for sdgs,government
122,national system of statistical and geographic information of mexico,government
123,natural resources for sustainable development,"private university, ngo, un, public university, ngo, private university, research  policy institutes, ngo"
124,nature-based solutions for disaster and climate resilience,un
125,normativa del snieg de mxico,un
126,"o guia de iniciao de juventude, paz e segurana",un
127,official statistics for sdgs,un
128,"one planet, one ocean","ngo, public university, ngo"
129,online diploma in multilateral diplomacy 2022  edition 2,un
130,"our earth: its climate, history, and processes",public university
131,our earth's future,cultural institution
132,our energy future,public university
133,partnerships: a vehicle for sustainable development,"un ngo, finance"
134,plan-cadre de coopration des nations unies pour le dveloppement durable,un
135,planetary boundaries and human opportunities,"public university, research  policy institutes, public university"
136,planning for climate change in african cities,"public university, government, public university, government"
137,policy coherence and systems thinking for sustainable development,"un, private university, government"
138,policy coherence for sustainable development,"private university, un, private university, government, un ngo"
139,"policy cycle, integrated approaches and sdgs",un
140,"policy cycle, integrated approaches and sdgs for african ldcs","research  policy institutes, un"
141,poverty statistics for sdgs,un
142,preparing for action national briefing package: the 2030 agenda and sdgs,un
143,principles of sustainable finance,public university
144,programming for child feeding,un
145,public financial management,un
146,public-private partnerships,un
147,public-private-partnerships (ppp),un
148,questionnaire development and testing,government
149,raising ambition - how to set science-based targets aligning with 1.5c pathways,"un, business"
150,regulations of the national system of statistical and geographic information,government
151,remote training on phone surveys,un
152,risk-informed governance and innovative technology for disaster risk reduction and resilience <u+200b>,un
153,sdg indicator 14.4.1 - fish stocks sustainability,un
154,sdg indicator 14.b.1 - securing sustainable small-scale fisheries,un
155,sdg indicator 2.1.1 - prevalence of undernourishment (pou),un
156,sdg indicator 2.1.2 - using the food insecurity experience scale (fies),un
157,sdg indicator 2.4.1 - sustainable agriculture,un
158,sdg indicator 2.a.1  agriculture orientation index,un
159,sdg indicator 2.c.1 - food price anomalies,un
160,sdg indicator 5.a.1 - equal tenure rights for women on agricultural land,un
161,sdg indicators 15.1.1 and 15.2.1 - forest area and sustainable forest management,un
162,sdg indicators 2.5.1 and 2.5.2 - plant and animal genetic resources,un
163,sdg lab toolkit,"un, un, ngo"
164,sdg primer,"un, un, ngo, un"
165,sdg sub-indicator 12.3.1.a  food loss index,un
166,sector extractivo: sostenibilidad y desarrollo en am<e9>rica latina y el caribe,"private university, ngo, public university, finance"
167,seea experimental ecosystem accounting,un
168,seea experimental ecosystem accounting,un
169,seea for policy makers,un
170,seea: in depth training on energy accounting,un
171,seea: in depth training on energy accounting,un
172,seea: in-depth training on water accounting,un
173,seea: in-depth training on water accounting,un
174,social indicators for public policies and programmes,government
175,social protection for sustainable development,"un, research  policy institutes, un"
176,statistical methods for correcting selection bias,research  policy institutes
177,strategic planning for territorial development and the 2030 agenda,un
178,strengthening institutional arrangements and governance capacities for policy coherence<u+200b>,un
179,strengthening institutional arrangements and governance capacities for policy coherence<u+200b>,un
180,strengthening stakeholder engagement for the 2030 agenda,"un, un"
181,survey skills development course,government
182,"sustainable business: big issues, big changes",public university
183,sustainable cities,"government, private university, public university, public university, private university, un, private university, research  policy institutes, government, public university, research  policy institutes, ngo"
184,sustainable development: the post-capitalist order,private university
185,sustainable food systems: a mediterranean perspective,"public university, public university, private university, public university, private university, research  policy institutes, public university, public university, public university, public university, public university, ngo"
186,system dynamics-based development planning,"public university, research  policy institutes"
187,taking the entrepreneurship route,un
188,taking the entrepreneurship route,un
189,tech for good: the role of ict in achieving the sdgs,"private university, un, private university, un, public university, un, ngo, research  policy institutes, ngo, government, un, un"
190,the age of sustainable development,private university
191,the best start in life: early childhood development for sustainable development,"private university, private university"
192,the gender statistics toolkit,"un, un"
193,the korean story: secrets of an economic miracle,"research  policy institutes, private university, government, private university, public university, public university, government, government"
194,the paris agreement on climate change as a development agenda,un
195,the sdg primer,"un, un ngo"
196,"the sdgs  a global, transdisciplinary vision for the future",public university
197,the turn: from reactionary populism to a progressive alternative,"private university, private university"
198,the un country team leadership course,un
199,the un sustainable development cooperation framework,un
200,the women ict frontier initiative (wifi),"un, un"
201,titles,au_category
202,trainfortrade e-learn course on international merchandise trade statistics,un
203,transforming development: the science and practice of resilience thinking,"research  policy institutes, public university"
204,transforming our world: achieving the sdgs,private university
205,"transparency, accountability and ethics in public institutions",un
206,un strategic communications for the 2030 agenda,"un, un"
207,un summer academy,un
208,un summer academy 2022,un
209,understanding data and statistics better,"un, un"
210,understanding poverty and inequality,"research  policy institutes, ngo, public university, ngo, private university, un, public university, public university, finance, un ngo"
211,unece gender statistics toolkit,un
212,unido iap,un
213,united nations development assistance framework (undaf),un
214,unleashing the power of the private sector for the 2030 agenda,un
215,unleashing the power of the private sector for the 2030 agenda - 2021,research  policy institutes
216,water: addressing the global crisis,"research  policy institutes, un, ngo, ngo, un"
217,web data collection and analysis,research  policy institutes
218,work and employment for a sustainable future,"private university, private university, private university, un, public university, public university, ngo"
,,
,,
,,
,,
,,
,,
,,
,,
,,
,,
,,
,,
,,
,,
,,
,,
,,
,,
,,
,,
,,
,,
,,
,,
,,
,,
,,
,,
,,
,,
,,
,,
,,
,,
,,
,,
,,
,,
,,
,,
,,
,,
,,
,,
,,
,,
,,
,,
