"","id.x","titles","au_category","description","id.y","key_category","stem","participation_keystems","policy_coh_keystems","democratic_keystems","reflex_adpt_keystems","max.col"
"61",112,"machine learning on satellite imagery","research  business","About
Skills in Machine Learning (ML) are ubiquitous for 21st century statisticians or Data Scientists. In this course you will be introduced to this field of science by covering the most popular tasks from supervised and unsupervised ML.
Motivated by the fact that remote-sensing imagery is already being used to address development issues, i.e. revealing changes in soil quality or water availability, informing agricultural interventions and even measuring poverty; we structured this course around ML methods which can be applied to satellite imagery, aiming to help statistical teams to leverage this modern and omnipresent data source.
Subject matter
The use of Big Data is accelerating within the development and humanitarian practice. If used right, its implementation can foster inclusion, efficiency, and lower project costs which may benefit public and private organizations involved on development programs. Therefore, our technical courses cover different aspects on data science and data engineering relevant for the context of official statistics and sustainable development.
Methodology
All the programing material is provided in Python<U+FFFD>using the conventional Open Source libraries for Data Science.<U+FFFD> Most of the sessions are interactive and on a Jupyter Notebook (.ipynb). A practical exercise is completed at the end of each session.
Format and instructors
This course is offered face-to-face (or via videoconference if necessary), it has a duration of 18 hours ideally distributed along 3 days, and is designed for 20 .<U+FFFD>Each course is delivered by a team of 2 training specialists.
Requirements
Some programming experience is required; Python is preferable though not necessary.
Syllabus
A. Introduction to supervised Machine Learning
Methods from supervised machine learning are those which have progressed more in both academic and industrial environments. We cover the task of classification, training a model for being able to categorize the observations we give to it. We examine algorithms as Logistic Regression, Support Vector Machines, Gradient Boosted Trees and Neural Networks going though its theoretical basis and applying them in practice.
B. Introduction to unsupervised Machine Learning
Unsupervised machine learning is currently the second most popular area of the field. We will cover the task of clustering, forming groups of observations which are similar in a previously defined sense. We will go through the theoretical principles and we will put in practice different algorithms such as k-means, Gaussian Mixture Model and others, which are popular in the field of computer vision.
C. Case study: Satellite imagery for measuring urban extent (SDG 11.3.1)
This case-study is developed with<U+FFFD>Landsat 8<U+FFFD>satellite images, which are free and accessible for everyone. Both supervised and unsupervised machine learning methods presented previously will be used to be able to infer urban extent from open satellite images, as part of the calculation of the SDG<U+FFFD> 11.3.1 (Tier 2).
We focus this exercise in using satellite imagery to bridge data gaps in measuring SDG the mentioned Tier 2 indicator, this means it is <U+FFFD>conceptually clear, has an internationally established methodology and standards are available, but for which data is not regularly produced by countries<U+FFFD>.
<U+FFFD>
									, About
Skills in Machine Learning (ML) are ubiquitous for 21st century statisticians or Data Scientists. In this course you will be introduced to this field of science by covering the most popular tasks from supervised and unsupervised ML., Motivated by the fact that remote-sensing imagery is already being used to address development issues, i.e. revealing changes in soil quality or water availability, informing agricultural interventions and even measuring poverty; we structured this course around ML methods which can be applied to satellite imagery, aiming to help statistical teams to leverage this modern and omnipresent data source., Subject matter
The use of Big Data is accelerating within the development and humanitarian practice. If used right, its implementation can foster inclusion, efficiency, and lower project costs which may benefit public and private organizations involved on development programs. Therefore, our technical courses cover different aspects on data science and data engineering relevant for the context of official statistics and sustainable development., Methodology
All the programing material is provided in Python<U+FFFD>using the conventional Open Source libraries for Data Science.<U+FFFD> Most of the sessions are interactive and on a Jupyter Notebook (.ipynb). A practical exercise is completed at the end of each session., Format and instructors
This course is offered face-to-face (or via videoconference if necessary), it has a duration of 18 hours ideally distributed along 3 days, and is designed for 20 .<U+FFFD>Each course is delivered by a team of 2 training specialists., Requirements
Some programming experience is required; Python is preferable though not necessary., Syllabus, A. Introduction to supervised Machine Learning, Methods from supervised machine learning are those which have progressed more in both academic and industrial environments. We cover the task of classification, training a model for being able to categorize the observations we give to it. We examine algorithms as Logistic Regression, Support Vector Machines, Gradient Boosted Trees and Neural Networks going though its theoretical basis and applying them in practice., B. Introduction to unsupervised Machine Learning, Unsupervised machine learning is currently the second most popular area of the field. We will cover the task of clustering, forming groups of observations which are similar in a previously defined sense. We will go through the theoretical principles and we will put in practice different algorithms such as k-means, Gaussian Mixture Model and others, which are popular in the field of computer vision., C. Case study: Satellite imagery for measuring urban extent (SDG 11.3.1), This case-study is developed with<U+FFFD>Landsat 8<U+FFFD>satellite images, which are free and accessible for everyone. Both supervised and unsupervised machine learning methods presented previously will be used to be able to infer urban extent from open satellite images, as part of the calculation of the SDG<U+FFFD> 11.3.1 (Tier 2)., We focus this exercise in using satellite imagery to bridge data gaps in measuring SDG the mentioned Tier 2 indicator, this means it is <U+FFFD>conceptually clear, has an internationally established methodology and standards are available, but for which data is not regularly produced by countries<U+FFFD>., <U+FFFD>, 
					Target audience
					This course is aimed at professionals for which programming is part of their daily activities or whom are leading a technical team.
				, This course is aimed at professionals for which programming is part of their daily activities or whom are leading a technical team., 
					Learning objectives
					Upon completion of the workshop you will be able to:
 Understand the basic concepts of supervised and unsupervised machine learning.
 Put into practice machine learning techniques for calculating an SDG indicator (SGD 11.3.1) using free satellite imagery.<U+FFFD>
, Upon completion of the workshop you will be able to:",205,"skills machine learning ml ubiquitous 21st century statisticians data scientists course introduced field science covering popular tasks supervised unsupervised ml motivated fact remote sensing imagery already used address development issues e revealing changes soil quality water availability informing agricultural interventions even measuring poverty structured course around ml methods can applied satellite imagery aiming help statistical teams leverage modern omnipresent data source subject matter use big data accelerating within development humanitarian practice used right implementation can foster inclusion efficiency lower project costs may benefit public private organizations involved development programs therefore technical courses cover different aspects data science data engineering relevant context official statistics sustainable development methodology programing material provided python using conventional open source libraries data science   sessions interactive jupyter notebook ipynb practical exercise completed end session format instructors course offered face face via videoconference necessary duration 18 hours ideally distributed along 3 days designed 20   course delivered team 2 training specialists requirements programming experience required python preferable though necessary syllabus introduction supervised machine learning methods supervised machine learning progressed academic industrial environments cover task classification training model able categorize observations give examine algorithms logistic regression support vector machines gradient boosted trees neural networks going though theoretical basis applying practice b introduction unsupervised machine learning unsupervised machine learning currently second popular area field cover task clustering forming groups observations similar previously defined sense go theoretical principles put practice different algorithms k means gaussian mixture model others popular field computer vision c case study satellite imagery measuring urban extent sdg 11 3 1 case study developed  landsat 8 satellite images free accessible everyone supervised unsupervised machine learning methods presented previously used able infer urban extent open satellite images part calculation sdg  11 3 1 tier 2 focus exercise using satellite imagery bridge data gaps measuring sdg mentioned tier 2 indicator means  conceptually clear internationally established methodology standards available data regularly produced countries    skills machine learning ml ubiquitous 21st century statisticians data scientists course introduced field science covering popular tasks supervised unsupervised ml motivated fact remote sensing imagery already used address development issues e revealing changes soil quality water availability informing agricultural interventions even measuring poverty structured course around ml methods can applied satellite imagery aiming help statistical teams leverage modern omnipresent data source subject matter use big data accelerating within development humanitarian practice used right implementation can foster inclusion efficiency lower project costs may benefit public private organizations involved development programs therefore technical courses cover different aspects data science data engineering relevant context official statistics sustainable development methodology programing material provided python using conventional open source libraries data science   sessions interactive jupyter notebook ipynb practical exercise completed end session format instructors course offered face face via videoconference necessary duration 18 hours ideally distributed along 3 days designed 20   course delivered team 2 training specialists requirements programming experience required python preferable though necessary syllabus introduction supervised machine learning methods supervised machine learning progressed academic industrial environments cover task classification training model able categorize observations give examine algorithms logistic regression support vector machines gradient boosted trees neural networks going though theoretical basis applying practice b introduction unsupervised machine learning unsupervised machine learning currently second popular area field cover task clustering forming groups observations similar previously defined sense go theoretical principles put practice different algorithms k means gaussian mixture model others popular field computer vision c case study satellite imagery measuring urban extent sdg 11 3 1 case study developed  landsat 8 satellite images free accessible everyone supervised unsupervised machine learning methods presented previously used able infer urban extent open satellite images part calculation sdg  11 3 1 tier 2 focus exercise using satellite imagery bridge data gaps measuring sdg mentioned tier 2 indicator means  conceptually clear internationally established methodology standards available data regularly produced countries    target audience course aimed professionals programming part daily activities leading technical team course aimed professionals programming part daily activities leading technical team learning objectives upon completion workshop able understand basic concepts supervised unsupervised machine learning put practice machine learning techniques calculating sdg indicator sgd 11 3 1 using free satellite imagery   upon completion workshop able","skill machin learn ml ubiquit 21st centuri statistician data scientist cours introduc field scienc cover popular task supervis unsupervis ml motiv fact remot sens imageri alreadi use address develop issu e reveal chang soil qualiti water avail inform agricultur intervent even measur poverti structur cours around ml method can appli satellit imageri aim help statist team leverag modern omnipres data sourc subject matter use big data acceler within develop humanitarian practic use right implement can foster inclus effici lower project cost may benefit public privat organ involv develop program therefor technic cours cover differ aspect data scienc data engin relev context offici statist sustain develop methodolog program materi provid python use convent open sourc librari data scienc session interact jupyt notebook ipynb practic exercis complet end session format instructor cours offer face face via videoconfer necessari durat 18 hour ideal distribut along 3 day design 20 cours deliv team 2 train specialist requir program experi requir python prefer though necessari syllabus introduct supervis machin learn method supervis machin learn progress academ industri environ cover task classif train model abl categor observ give examin algorithm logist regress support vector machin gradient boost tree neural network go though theoret basi appli practic b introduct unsupervis machin learn unsupervis machin learn current second popular area field cover task cluster form group observ similar previous defin sens go theoret principl put practic differ algorithm k mean gaussian mixtur model other popular field comput vision c case studi satellit imageri measur urban extent sdg 11 3 1 case studi develop landsat 8 satellit imag free access everyon supervis unsupervis machin learn method present previous use abl infer urban extent open satellit imag part calcul sdg 11 3 1 tier 2 focus exercis use satellit imageri bridg data gap measur sdg mention tier 2 indic mean conceptu clear intern establish methodolog standard avail data regular produc countri skill machin learn ml ubiquit 21st centuri statistician data scientist cours introduc field scienc cover popular task supervis unsupervis ml motiv fact remot sens imageri alreadi use address develop issu e reveal chang soil qualiti water avail inform agricultur intervent even measur poverti structur cours around ml method can appli satellit imageri aim help statist team leverag modern omnipres data sourc subject matter use big data acceler within develop humanitarian practic use right implement can foster inclus effici lower project cost may benefit public privat organ involv develop program therefor technic cours cover differ aspect data scienc data engin relev context offici statist sustain develop methodolog program materi provid python use convent open sourc librari data scienc session interact jupyt notebook ipynb practic exercis complet end session format instructor cours offer face face via videoconfer necessari durat 18 hour ideal distribut along 3 day design 20 cours deliv team 2 train specialist requir program experi requir python prefer though necessari syllabus introduct supervis machin learn method supervis machin learn progress academ industri environ cover task classif train model abl categor observ give examin algorithm logist regress support vector machin gradient boost tree neural network go though theoret basi appli practic b introduct unsupervis machin learn unsupervis machin learn current second popular area field cover task cluster form group observ similar previous defin sens go theoret principl put practic differ algorithm k mean gaussian mixtur model other popular field comput vision c case studi satellit imageri measur urban extent sdg 11 3 1 case studi develop landsat 8 satellit imag free access everyon supervis unsupervis machin learn method present previous use abl infer urban extent open satellit imag part calcul sdg 11 3 1 tier 2 focus exercis use satellit imageri bridg data gap measur sdg mention tier 2 indic mean conceptu clear intern establish methodolog standard avail data regular produc countri target audienc cours aim profession program part daili activ lead technic team cours aim profession program part daili activ lead technic team learn object upon complet workshop abl understand basic concept supervis unsupervis machin learn put practic machin learn techniqu calcul sdg indic sgd 11 3 1 use free satellit imageri upon complet workshop abl",13,8,4,19,"reflex_adpt_keystems"
"62",113,"macroeconomics for a sustainable planet","private university, government","Building a new toolkit for the 21st-century macroeconomist , Building a new toolkit for the 21st-century macroeconomist , How do we measure progress?, Are those measures enough?, How does business investment relate to, consumption and saving, Considerations from digitization, to unemployment,, to the minimum wage, Internalizing social capital and, environmental impact, Unemployment. Inflation. Protectionism. Trade barriers. Fiscal deficit. These are not just terms in an economics textbook or in newspaper headlines. These real-life challenges carry societal and environmental implications for billions of people around the world. How do we balance the pursuit of economic growth with the right of all people to thrive on an increasingly fragile planet? To answer this question, we must reframe our understanding of macroeconomics in the context of a highly interdependent world.Led by two leading economic minds <U+FFFD> Columbia University Professor Jeffrey Sachs and Chilean Minister of Finance Felipe Larra<U+FFFD>n <U+FFFD> this massive open online course explores traditional macroeconomic principles and tools, updated for the age of sustainable development and the current wave of globalization. Is a thriving global economy possible in an equitable and environmentally thoughtful way? Find out here., Unemployment. Inflation. Protectionism. Trade barriers. Fiscal deficit. These are not just terms in an economics textbook or in newspaper headlines. These real-life challenges carry societal and environmental implications for billions of people around the world. How do we balance the pursuit of economic growth with the right of all people to thrive on an increasingly fragile planet? To answer this question, we must reframe our understanding of macroeconomics in the context of a highly interdependent world., Led by two leading economic minds <U+FFFD> Columbia University Professor Jeffrey Sachs and Chilean Minister of Finance Felipe Larra<U+FFFD>n <U+FFFD> this massive open online course explores traditional macroeconomic principles and tools, updated for the age of sustainable development and the current wave of globalization. Is a thriving global economy possible in an equitable and environmentally thoughtful way? Find out here., Graduate students and advanced undergraduate students studying international development, economics and/or sustainable development, Economists interested in the balance of macroeconomic principles and ESG (environmental, societal and governance) criteria, Sustainable development practitioners <U+FFFD> as well as private-sector actors, such as those who work in the financial sector <U+FFFD> who need to understand the economic models that support and depend on sustainable development,  Module 1: Introduction to Macroeconomics,  Module 2A: Output Determination & Employment,  Module 2B: Output Determination & Employment,  Module 3: Labor Markets,  Module 4: Money & Central Banking,  Module 5: Exchange Rate Themes,  Module 6: Financial Markets & Financial Crises,  Module 7: Inflation, Unemployment & Stabilization,  Module 8: Consumption, Saving & Investme,  Module 9: Fiscal Policy and Institutions,  Module 10: Open Economy Issues,  Module 11: Economic Growth,  Module 12: Globalization",105,"building new toolkit 21st century macroeconomist building new toolkit 21st century macroeconomist measure progress measures enough business investment relate consumption saving considerations digitization unemployment minimum wage internalizing social capital environmental impact unemployment inflation protectionism trade barriers fiscal deficit just terms economics textbook newspaper headlines real life challenges carry societal environmental implications billions people around world balance pursuit economic growth right people thrive increasingly fragile planet answer question must reframe understanding macroeconomics context highly interdependent world led two leading economic minds   columbia university professor jeffrey sachs chilean minister finance felipe larra n   massive open online course explores traditional macroeconomic principles tools updated age sustainable development current wave globalization thriving global economy possible equitable environmentally thoughtful way find unemployment inflation protectionism trade barriers fiscal deficit just terms economics textbook newspaper headlines real life challenges carry societal environmental implications billions people around world balance pursuit economic growth right people thrive increasingly fragile planet answer question must reframe understanding macroeconomics context highly interdependent world led two leading economic minds   columbia university professor jeffrey sachs chilean minister finance felipe larra n   massive open online course explores traditional macroeconomic principles tools updated age sustainable development current wave globalization thriving global economy possible equitable environmentally thoughtful way find graduate students advanced undergraduate students studying international development economics sustainable development economists interested balance macroeconomic principles esg environmental societal governance criteria sustainable development practitioners   well private sector actors work financial sector   need understand economic models support depend sustainable development module 1 introduction macroeconomics module 2a output determination employment module 2b output determination employment module 3 labor markets module 4 money central banking module 5 exchange rate themes module 6 financial markets financial crises module 7 inflation unemployment stabilization module 8 consumption saving investme module 9 fiscal policy institutions module 10 open economy issues module 11 economic growth module 12 globalization","build new toolkit 21st centuri macroeconomist build new toolkit 21st centuri macroeconomist measur progress measur enough busi invest relat consumpt save consider digit unemploy minimum wage intern social capit environment impact unemploy inflat protection trade barrier fiscal deficit just term econom textbook newspap headlin real life challeng carri societ environment implic billion peopl around world balanc pursuit econom growth right peopl thrive increas fragil planet answer question must refram understand macroeconom context high interdepend world led two lead econom mind columbia univers professor jeffrey sach chilean minist financ felip larra n massiv open onlin cours explor tradit macroeconom principl tool updat age sustain develop current wave global thrive global economi possibl equit environment thought way find unemploy inflat protection trade barrier fiscal deficit just term econom textbook newspap headlin real life challeng carri societ environment implic billion peopl around world balanc pursuit econom growth right peopl thrive increas fragil planet answer question must refram understand macroeconom context high interdepend world led two lead econom mind columbia univers professor jeffrey sach chilean minist financ felip larra n massiv open onlin cours explor tradit macroeconom principl tool updat age sustain develop current wave global thrive global economi possibl equit environment thought way find graduat student advanc undergradu student studi intern develop econom sustain develop economist interest balanc macroeconom principl esg environment societ govern criteria sustain develop practition well privat sector actor work financi sector need understand econom model support depend sustain develop modul 1 introduct macroeconom modul 2a output determin employ modul 2b output determin employ modul 3 labor market modul 4 money central bank modul 5 exchang rate theme modul 6 financi market financi crise modul 7 inflat unemploy stabil modul 8 consumpt save investm modul 9 fiscal polici institut modul 10 open economi issu modul 11 econom growth modul 12 global",0,3,2,2,"policy_coh_keystems"
