"","id.x","titles","au_category","description","id.y","key_category","stem","participation_keystems","policy_coh_keystems","democratic_keystems","reflex_adpt_keystems","max.col"
"1",1,"act on climate: steps to individual, community, and political action","public university","Are you concerned about climate change? Would you like to learn how to address and respond to this challenge? If so, this course is for you.  , Act on Climate: Steps to Individual, Community, and Political Action is intended to help learners understand, address and respond to climate change as individuals and in partnership with their communities and political leaders. The course focuses on how to translate learning into action on climate change in the areas of food, energy, transportation and the built environment (cities). This course was co-developed and taught by Michaela Zint, Professor of Environmental Education and Communication, and University of Michigan Students. A range of academic climate change experts and professional leaders are featured.

As a result of completing this course, you will be able to:

1) Identify individual, community, and political actions you can engage in to effectively address and respond to climate change.

2) Describe how insights from the social sciences can be employed to create change at the individual, community, and political levels.

3) Feel empowered to continue to influence how you, your community, and political leaders address and respond to climate change.

Use #UMichActonClimate on social media to share what you're doing and connect with other learners.",22,"concerned climate change like learn address respond challenge course act climate steps individual community political action intended help learners understand address respond climate change individuals partnership communities political leaders course focuses translate learning action climate change areas food energy transportation built environment cities course co developed taught michaela zint professor environmental education communication university michigan students range academic climate change experts professional leaders featured result completing course able 1 identify individual community political actions can engage effectively address respond climate change 2 describe insights social sciences can employed create change individual community political levels 3 feel empowered continue influence community political leaders address respond climate change use umichactonclimate social media share re connect learners","concern climat chang like learn address respond challeng cours act climat step individu communiti polit action intend help learner understand address respond climat chang individu partnership communiti polit leader cours focus translat learn action climat chang area food energi transport built environ citi cours co develop taught michaela zint professor environment educ communic univers michigan student rang academ climat chang expert profession leader featur result complet cours abl 1 identifi individu communiti polit action can engag effect address respond climat chang 2 describ insight social scienc can employ creat chang individu communiti polit level 3 feel empow continu influenc communiti polit leader address respond climat chang use umichactonclim social media share re connect learner",1,1,6,1,"democratic_keystems"
"2",3,"administrative records quality assessment tool (hecra)","government","At the end of the course, the  will value the importance of the quality of administrative information to produce quality statistical and geographic information, to strengthen decision-making. Likewise, they will identify the main methodological characteristics of the Administrative Records Quality Assessment Tool (HECRA) and of the system developed for its application, reaching the required knowledge to participate in evaluation and quality improvement actions of the administrative records used in the generation of statistical and geographic information.
											
							Download syllabus
							
									, At the end of the course, the  will value the importance of the quality of administrative information to produce quality statistical and geographic information, to strengthen decision-making. Likewise, they will identify the main methodological characteristics of the Administrative Records Quality Assessment Tool (HECRA) and of the system developed for its application, reaching the required knowledge to participate in evaluation and quality improvement actions of the administrative records used in the generation of statistical and geographic information., 
					Target audience
					Personnel of the State Units that generate or use administrative records to produce statistical or geographic information with basic knowledge in:
Statistical or geographic information generation processes from the use of administrative records.
Use of computer equipment and internet browsing.
				, Personnel of the State Units that generate or use administrative records to produce statistical or geographic information with basic knowledge in:, Statistical or geographic information generation processes from the use of administrative records., Use of computer equipment and internet browsing., 
					Learning objectives
					Objectives:
Evaluate and improve the quality of the Administrative Records to be used for statistical purposes.
Detect problems and opportunities for improvement of the records analyzed.
Identify and analyze the causes of problems.
Implement corrective and preventive action plans.
, Objectives:",76,"end course value importance quality administrative information produce quality statistical geographic information strengthen decision making likewise identify main methodological characteristics administrative records quality assessment tool hecra system developed application reaching required knowledge participate evaluation quality improvement actions administrative records used generation statistical geographic information download syllabus end course value importance quality administrative information produce quality statistical geographic information strengthen decision making likewise identify main methodological characteristics administrative records quality assessment tool hecra system developed application reaching required knowledge participate evaluation quality improvement actions administrative records used generation statistical geographic information target audience personnel state units generate use administrative records produce statistical geographic information basic knowledge statistical geographic information generation processes use administrative records use computer equipment internet browsing personnel state units generate use administrative records produce statistical geographic information basic knowledge statistical geographic information generation processes use administrative records use computer equipment internet browsing learning objectives objectives evaluate improve quality administrative records used statistical purposes detect problems opportunities improvement records analyzed identify analyze causes problems implement corrective preventive action plans objectives","end cours valu import qualiti administr inform produc qualiti statist geograph inform strengthen decis make likewis identifi main methodolog characterist administr record qualiti assess tool hecra system develop applic reach requir knowledg particip evalu qualiti improv action administr record use generat statist geograph inform download syllabus end cours valu import qualiti administr inform produc qualiti statist geograph inform strengthen decis make likewis identifi main methodolog characterist administr record qualiti assess tool hecra system develop applic reach requir knowledg particip evalu qualiti improv action administr record use generat statist geograph inform target audienc personnel state unit generat use administr record produc statist geograph inform basic knowledg statist geograph inform generat process use administr record use comput equip internet brows personnel state unit generat use administr record produc statist geograph inform basic knowledg statist geograph inform generat process use administr record use comput equip internet brows learn object object evalu improv qualiti administr record use statist purpos detect problem opportun improv record analyz identifi analyz caus problem implement correct prevent action plan object",4,0,0,14,"reflex_adpt_keystems"
