"","id.x","titles","au_category","description","id.y","key_category","stem","participation_keystems","policy_coh_keystems","democratic_keystems","reflex_adpt_keystems","max.col"
"85",164,"sdg primer","un, un, civil society, un","The 2030 Agenda for Sustainable Development constitutes a paradigm shift. It requires understanding and articulating a narrative around the meaning and value of sustainable development, how the Sustainable Development Goals interrelate across various sectors, and what it will take to achieve them.
The SDG Primer resulted from a collaborative effort undertaken under the United Nations Sustainable Development Group that assembled the most relevant thinking and insights around key global and national SDG-related challenges. It has been developed with the support of UNSSC, UNITAR, SDSN, and UNDCO.
The SDG Primer lays out the:
Urgency of action required by all actors in all countries;
Foundational characteristics of this universal and integrated framework;
Specific actions we can all take to better support countries and governments.
It should take approximately 3 hours to complete the SDG Primer.
The course is available in two languages: English and Arabic.
									, The 2030 Agenda for Sustainable Development constitutes a paradigm shift. It requires understanding and articulating a narrative around the meaning and value of sustainable development, how the Sustainable Development Goals interrelate across various sectors, and what it will take to achieve them., The SDG Primer resulted from a collaborative effort undertaken under the United Nations Sustainable Development Group that assembled the most relevant thinking and insights around key global and national SDG-related challenges. It has been developed with the support of UNSSC, UNITAR, SDSN, and UNDCO., The SDG Primer lays out the:, It should take approximately 3 hours to complete the SDG Primer., The course is available in two languages: English and Arabic., 
					Target audience
					General audience: Anyone who is interested in or working on the SDGs is welcome to join!
				, General audience: Anyone who is interested in or working on the SDGs is welcome to join!, 
					Learning objectives
					At the end of the SDG Primer,
learners will have the ability and will to act decisively and realize the Agenda<U+FFFD>s transformative vision remain elusive;
learners will learn how the SDG framework can help countries reframe challenges in their contexts, analyse connections across goals and sectors, design innovative solutions that manage and harness these connections, and chart transformative pathways to development systems that are sustainable and resilient to future uncertainties;
learners will learn how the SDGs come to life through their primary implementing agents: national governments, the signatories of the 2030 Agenda;
learners will learn some vital points of connection and opportunities for collaboration, covering key actors and their roles.
, At the end of the SDG Primer,",28,"2030 agenda sustainable development constitutes paradigm shift requires understanding articulating narrative around meaning value sustainable development sustainable development goals interrelate across various sectors take achieve sdg primer resulted collaborative effort undertaken united nations sustainable development group assembled relevant thinking insights around key global national sdg related challenges developed support unssc unitar sdsn undco sdg primer lays urgency action required actors countries foundational characteristics universal integrated framework specific actions can take better support countries governments take approximately 3 hours complete sdg primer course available two languages english arabic 2030 agenda sustainable development constitutes paradigm shift requires understanding articulating narrative around meaning value sustainable development sustainable development goals interrelate across various sectors take achieve sdg primer resulted collaborative effort undertaken united nations sustainable development group assembled relevant thinking insights around key global national sdg related challenges developed support unssc unitar sdsn undco sdg primer lays take approximately 3 hours complete sdg primer course available two languages english arabic target audience general audience anyone interested working sdgs welcome join general audience anyone interested working sdgs welcome join learning objectives end sdg primer learners ability act decisively realize agenda s transformative vision remain elusive learners learn sdg framework can help countries reframe challenges contexts analyse connections across goals sectors design innovative solutions manage harness connections chart transformative pathways development systems sustainable resilient future uncertainties learners learn sdgs come life primary implementing agents national governments signatories 2030 agenda learners learn vital points connection opportunities collaboration covering key actors roles end sdg primer","2030 agenda sustain develop constitut paradigm shift requir understand articul narrat around mean valu sustain develop sustain develop goal interrel across various sector take achiev sdg primer result collabor effort undertaken unit nation sustain develop group assembl relev think insight around key global nation sdg relat challeng develop support unssc unitar sdsn undco sdg primer lay urgenc action requir actor countri foundat characterist univers integr framework specif action can take better support countri govern take approxim 3 hour complet sdg primer cours avail two languag english arab 2030 agenda sustain develop constitut paradigm shift requir understand articul narrat around mean valu sustain develop sustain develop goal interrel across various sector take achiev sdg primer result collabor effort undertaken unit nation sustain develop group assembl relev think insight around key global nation sdg relat challeng develop support unssc unitar sdsn undco sdg primer lay take approxim 3 hour complet sdg primer cours avail two languag english arab target audienc general audienc anyon interest work sdgs welcom join general audienc anyon interest work sdgs welcom join learn object end sdg primer learner abil act decis realiz agenda s transform vision remain elus learner learn sdg framework can help countri refram challeng context analys connect across goal sector design innov solut manag har connect chart transform pathway develop system sustain resili futur uncertainti learner learn sdgs come life primari implement agent nation govern signatori 2030 agenda learner learn vital point connect opportun collabor cover key actor role end sdg primer",6,8,5,2,"policy_coh_keystems"
"86",166,"sector extractivo: sostenibilidad y desarrollo en am<e9>rica latina y el caribe","private university, civil society, public university, research  business","Este curso explora las oportunidades y los desaf<U+FFFD>os en el uso del petr<U+FFFD>leo, el gas y los recursos minerales para impulsar el desarrollo sostenible en Am<U+FFFD>rica Latina y el Caribe., Este curso explora las oportunidades y los desaf<U+FFFD>os en el uso del petr<U+FFFD>leo, el gas y los recursos minerales para impulsar el desarrollo sostenible en Am<U+FFFD>rica Latina y el Caribe., <U+FFFD>C<U+FFFD>mo traducen los pa<U+FFFD>ses la riqueza de los recursos naturales en, <U+FFFD>RESULTADOS DE DESARROLLO SOSTENIBLE?, <U+FFFD>Qu<U+FFFD> pol<U+FFFD>ticas son necesarias para la gesti<U+FFFD>n sostenible de, LA RIQUEZA DE RECURSOS NATURALES?,  Sobre este curso Los recursos naturales representan una oportunidad potencialmente transformadora para apoyar el desarrollo, pero en <U+FFFD>ltima instancia son limitados. <U+FFFD>C<U+FFFD>mo podemos aprovecharlos al m<U+FFFD>ximo sin destruir el planeta? En este curso de 6 semanas podr<U+FFFD>s conocer acerca de algunos de los esfuerzos generales que se han implementado para administrar de manera sostenible las inversiones de la industria extractiva. Adem<U+FFFD>s, te familiarizar<U+FFFD>s con los complejos aspectos e interrelacionados de la gobernanza de los recursos naturales y formar<U+FFFD>s parte de un movimiento mundial de ciudadanos y profesionales comprometidos con aprovechar los impactos transformadores de los recursos naturales no renovables.Este curso fue producido por el Banco Interamericano de Desarrollo y la SDG Academy con el apoyo del Columbia Center on Sustainable Investment y el Natural Resource Governance Institute.,  Sobre este curso , Los recursos naturales representan una oportunidad potencialmente transformadora para apoyar el desarrollo, pero en <U+FFFD>ltima instancia son limitados. <U+FFFD>C<U+FFFD>mo podemos aprovecharlos al m<U+FFFD>ximo sin destruir el planeta? En este curso de 6 semanas podr<U+FFFD>s conocer acerca de algunos de los esfuerzos generales que se han implementado para administrar de manera sostenible las inversiones de la industria extractiva. Adem<U+FFFD>s, te familiarizar<U+FFFD>s con los complejos aspectos e interrelacionados de la gobernanza de los recursos naturales y formar<U+FFFD>s parte de un movimiento mundial de ciudadanos y profesionales comprometidos con aprovechar los impactos transformadores de los recursos naturales no renovables., Este curso fue producido por el Banco Interamericano de Desarrollo y la SDG Academy con el apoyo del Columbia Center on Sustainable Investment y el Natural Resource Governance Institute., <U+FFFD>Qui<U+FFFD>nes deber<U+FFFD>an tomar este curso?:, Profesionales dedicados al desarrollo sostenible, funcionarios p<U+FFFD>blicos, la sociedad civil y el sector privado, que necesitan comprender el contexto hist<U+FFFD>rico de la industria extractiva y su evoluci<U+FFFD>n., Profesionales del sector extractivo, tales como aquellos que trabajan en las industrias del petr<U+FFFD>leo, gas y miner<U+FFFD>a, que est<U+FFFD>n interesados en lograr que la industria sea m<U+FFFD>s sostenible., Estudiantes de posgrado y estudiantes avanzados de pregrado especializados en las industrias<U+FFFD> extractivas o en ciencias ambientales, derecho ambiental, desarrollo sostenible, negocios sostenibles y sectores relacionados., Activistas ambientales o profesionales que buscan lograr un balance entre una gesti<U+FFFD>n sustentable de los recursos naturales y el negocio extractivo.,  M<U+FFFD>dulo 1: Recursos naturales: desaf<U+FFFD>os, oportunidades y cuestiones pol<U+FFFD>ticas,  M<U+FFFD>dulo 2: Los fundamentos de las industrias extractivas: marco legal y econom<U+FFFD>a de recursos,  M<U+FFFD>dulo 3: Anticipando y gestionando los temas ambientales,  M<U+FFFD>dulo 4: Industrias extractivas a nivel local: derechos de comunidades y miner<U+FFFD>a artesanal,  M<U+FFFD>dulo 5: Gesti<U+FFFD>n de ingresos p<U+FFFD>blicos,  M<U+FFFD>dulo 6: Inversi<U+FFFD>n en desarrollo sostenible: mirando al futuro",94,"este curso explora las oportunidades y los desaf os en el uso del petr leo el gas y los recursos minerales para impulsar el desarrollo sostenible en  rica latina y el caribe este curso explora las oportunidades y los desaf os en el uso del petr leo el gas y los recursos minerales para impulsar el desarrollo sostenible en  rica latina y el caribe  c mo traducen los pa ses la riqueza de los recursos naturales en  resultados de desarrollo sostenible  qu  pol ticas son necesarias para la gesti n sostenible de la riqueza de recursos naturales sobre este curso los recursos naturales representan una oportunidad potencialmente transformadora para apoyar el desarrollo pero en  ltima instancia son limitados  c mo podemos aprovecharlos al m ximo sin destruir el planeta en este curso de 6 semanas podr s conocer acerca de algunos de los esfuerzos generales que se han implementado para administrar de manera sostenible las inversiones de la industria extractiva adem s te familiarizar s con los complejos aspectos e interrelacionados de la gobernanza de los recursos naturales y formar s parte de un movimiento mundial de ciudadanos y profesionales comprometidos con aprovechar los impactos transformadores de los recursos naturales renovables este curso fue producido por el banco interamericano de desarrollo y la sdg academy con el apoyo del columbia center sustainable investment y el natural resource governance institute sobre este curso los recursos naturales representan una oportunidad potencialmente transformadora para apoyar el desarrollo pero en  ltima instancia son limitados  c mo podemos aprovecharlos al m ximo sin destruir el planeta en este curso de 6 semanas podr s conocer acerca de algunos de los esfuerzos generales que se han implementado para administrar de manera sostenible las inversiones de la industria extractiva adem s te familiarizar s con los complejos aspectos e interrelacionados de la gobernanza de los recursos naturales y formar s parte de un movimiento mundial de ciudadanos y profesionales comprometidos con aprovechar los impactos transformadores de los recursos naturales renovables este curso fue producido por el banco interamericano de desarrollo y la sdg academy con el apoyo del columbia center sustainable investment y el natural resource governance institute  qui nes deber  tomar este curso profesionales dedicados al desarrollo sostenible funcionarios p blicos la sociedad civil y el sector privado que necesitan comprender el contexto hist rico de la industria extractiva y su evoluci n profesionales del sector extractivo tales como aquellos que trabajan en las industrias del petr leo gas y miner  que est n interesados en lograr que la industria sea m s sostenible estudiantes de posgrado y estudiantes avanzados de pregrado especializados en las industrias  extractivas o en ciencias ambientales derecho ambiental desarrollo sostenible negocios sostenibles y sectores relacionados activistas ambientales o profesionales que buscan lograr un balance entre una gesti n sustentable de los recursos naturales y el negocio extractivo m dulo 1 recursos naturales desaf os oportunidades y cuestiones pol ticas m dulo 2 los fundamentos de las industrias extractivas marco legal y econom  de recursos m dulo 3 anticipando y gestionando los temas ambientales m dulo 4 industrias extractivas nivel local derechos de comunidades y miner  artesanal m dulo 5 gesti n de ingresos p blicos m dulo 6 inversi n en desarrollo sostenible mirando al futuro","est curso explora las oportunidad y los desaf os en el uso del petr leo el gas y los recurso mineral para impulsar el desarrollo sosten en rica latina y el carib est curso explora las oportunidad y los desaf os en el uso del petr leo el gas y los recurso mineral para impulsar el desarrollo sosten en rica latina y el carib c mo traducen los pa ses la riqueza de los recurso natural en resultado de desarrollo sosten qu pol tica son necesaria para la gesti n sosten de la riqueza de recurso natural sobr est curso los recurso natural representan una oportunidad potencialment transformadora para apoyar el desarrollo pero en ltima instancia son limitado c mo podemo aprovecharlo al m ximo sin destruir el planeta en est curso de 6 semana podr s conoc acerca de alguno de los esfuerzo general que se han implementado para administrar de manera sosten las inversion de la industria extractiva adem s te familiarizar s con los complejo aspecto e interrelacionado de la gobernanza de los recurso natural y formar s part de un movimiento mundial de ciudadano y profesional comprometido con aprovechar los impacto transformador de los recurso natural renov est curso fue producido por el banco interamericano de desarrollo y la sdg academi con el apoyo del columbia center sustain invest y el natur resourc govern institut sobr est curso los recurso natural representan una oportunidad potencialment transformadora para apoyar el desarrollo pero en ltima instancia son limitado c mo podemo aprovecharlo al m ximo sin destruir el planeta en est curso de 6 semana podr s conoc acerca de alguno de los esfuerzo general que se han implementado para administrar de manera sosten las inversion de la industria extractiva adem s te familiarizar s con los complejo aspecto e interrelacionado de la gobernanza de los recurso natural y formar s part de un movimiento mundial de ciudadano y profesional comprometido con aprovechar los impacto transformador de los recurso natural renov est curso fue producido por el banco interamericano de desarrollo y la sdg academi con el apoyo del columbia center sustain invest y el natur resourc govern institut qui nes deber tomar est curso profesional dedicado al desarrollo sosten funcionario p blico la sociedad civil y el sector privado que necesitan comprend el contexto hist rico de la industria extractiva y su evoluci n profesional del sector extractivo tale como aquello que trabajan en las industria del petr leo gas y miner que est n interesado en lograr que la industria sea m s sosten estudiant de posgrado y estudiant avanzado de pregrado especializado en las industria extractiva o en ciencia ambiental derecho ambient desarrollo sosten negocio sosten y sector relacionado activista ambiental o profesional que buscan lograr un balanc entr una gesti n sustent de los recurso natural y el negocio extractivo m dulo 1 recurso natural desaf os oportunidad y cuestion pol tica m dulo 2 los fundamento de las industria extractiva marco legal y econom de recurso m dulo 3 anticipando y gestionando los tema ambiental m dulo 4 industria extractiva nivel local derecho de comunidad y miner artesan m dulo 5 gesti n de ingreso p blico m dulo 6 inversi n en desarrollo sosten mirando al futuro",0,1,5,0,"democratic_keystems"
"87",174,"social indicators for public policies and programmes","government","This course is offered by professor Paulo Jannuzzi of the National School of Statistical Sciences (ENCE). The content encompasses concepts, types and properties of indicators; information demand for the elaboration and evaluation of policies and programmes; indicators and international agenda (SDGs); main data sources, social reports and research; main indicators on labor market, income inequality and poverty; use of indicators for socioeconomic diagnoses and management capacity.
									, This course is offered by professor Paulo Jannuzzi of the National School of Statistical Sciences (ENCE). The content encompasses concepts, types and properties of indicators; information demand for the elaboration and evaluation of policies and programmes; indicators and international agenda (SDGs); main data sources, social reports and research; main indicators on labor market, income inequality and poverty; use of indicators for socioeconomic diagnoses and management capacity., 
					Target audience
					Civil servants, researchers and students.
				, Civil servants, researchers and students., 
					Learning objectives
					Analyse and apply information from governmental institutions and research centers to elaborate public policies and programmes.
				, Analyse and apply information from governmental institutions and research centers to elaborate public policies and programmes.",144,"course offered professor paulo jannuzzi national school statistical sciences ence content encompasses concepts types properties indicators information demand elaboration evaluation policies programmes indicators international agenda sdgs main data sources social reports research main indicators labor market income inequality poverty use indicators socioeconomic diagnoses management capacity course offered professor paulo jannuzzi national school statistical sciences ence content encompasses concepts types properties indicators information demand elaboration evaluation policies programmes indicators international agenda sdgs main data sources social reports research main indicators labor market income inequality poverty use indicators socioeconomic diagnoses management capacity target audience civil servants researchers students civil servants researchers students learning objectives analyse apply information governmental institutions research centers elaborate public policies programmes analyse apply information governmental institutions research centers elaborate public policies programmes","cours offer professor paulo jannuzzi nation school statist scienc enc content encompass concept type properti indic inform demand elabor evalu polici programm indic intern agenda sdgs main data sourc social report research main indic labor market incom inequ poverti use indic socioeconom diagnos manag capac cours offer professor paulo jannuzzi nation school statist scienc enc content encompass concept type properti indic inform demand elabor evalu polici programm indic intern agenda sdgs main data sourc social report research main indic labor market incom inequ poverti use indic socioeconom diagnos manag capac target audienc civil servant research student civil servant research student learn object analys appli inform government institut research center elabor public polici programm analys appli inform government institut research center elabor public polici programm",0,0,4,12,"reflex_adpt_keystems"
