"","id.x","titles","au_category","description","id.y","key_category","stem","participation_keystems","policy_coh_keystems","democratic_keystems","reflex_adpt_keystems","max.col"
"29",45,"ethics in action","private university, civil society","What do the world<U+FFFD>s great religious and secular philosophies have to say about ethical conduct? Which virtues are common across faiths? And what role do religious communities have to play in building a more just and sustainable world?, What do the world<U+FFFD>s great religious and secular philosophies have to say about ethical conduct? Which virtues are common across faiths? And what role do religious communities have to play in building a more just and sustainable world?, How faith communities can help advance, SUSTAINABLE DEVELOPMENT, Working together to save, OUR COMMON HOME, What can be done to address the, CHALLENGES OF OUR TIME, Developing as individuals and as a society for, THE GOOD OF ALL, The challenges of sustainable development are more than technical or political<U+FFFD>they are also moral, calling on us to examine who we are as human beings, and who we want to be going forward.This examination of what makes a <U+FFFD>good person<U+FFFD><U+FFFD>called virtue ethics<U+FFFD>has long been the purview of philosophers and theologians. So what do the world<U+FFFD>s great religious and secular philosophies have to say about ethical conduct? Which virtues are common across creeds and cultures? And what role do ethics, spirituality, and religious communities have to play in sustainable development?In 2016, distinguished leaders from the world<U+FFFD>s major religious traditions, philosophers, scholars, and scientists were invited by Pope Francis to the Vatican for a series of meetings. Known as the Ethics in Action initiative, these meetings sought to promote dialogue and find consensus about the values needed to advance transformative action for our common home and the human family.This course features Ethics in Action meeting , as well as other leading voices, and discusses the perspectives of some of the world<U+FFFD>s great traditions and their role in addressing our world<U+FFFD>s most pressing challenges, including poverty, corruption, and climate change. It presents multi-faith cooperation as essential for achieving sustainable development, and calls for the development of a new shared virtue ethics to bring us all into a sustainable and peaceful future.You will learn:The meaning of virtue ethics and its expression in several major religious and philosophical traditions;The importance of establishing multi-faith consensus to advance sustainable development;The importance of involving faith communities in peace and development work;How ethics motivates the actions of religious and secular leaders, politicians, scientists, civil society, and business;What shared virtue ethics are needed to create a more peaceful and prosperous world for everyone., The challenges of sustainable development are more than technical or political<U+FFFD>they are also moral, calling on us to examine who we are as human beings, and who we want to be going forward., This examination of what makes a <U+FFFD>good person<U+FFFD><U+FFFD>called virtue ethics<U+FFFD>has long been the purview of philosophers and theologians. So what do the world<U+FFFD>s great religious and secular philosophies have to say about ethical conduct? Which virtues are common across creeds and cultures? And what role do ethics, spirituality, and religious communities have to play in sustainable development?, In 2016, distinguished leaders from the world<U+FFFD>s major religious traditions, philosophers, scholars, and scientists were invited by Pope Francis to the Vatican for a series of meetings. Known as the Ethics in Action initiative, these meetings sought to promote dialogue and find consensus about the values needed to advance transformative action for our common home and the human family., This course features Ethics in Action meeting , as well as other leading voices, and discusses the perspectives of some of the world<U+FFFD>s great traditions and their role in addressing our world<U+FFFD>s most pressing challenges, including poverty, corruption, and climate change. It presents multi-faith cooperation as essential for achieving sustainable development, and calls for the development of a new shared virtue ethics to bring us all into a sustainable and peaceful future., You will learn:, Religious and spiritual communities and individuals who want to contribute to the work of sustainable development, Development professionals who want to understand and engage local faith communities, Advanced undergraduates and graduate students interested in philosophy, religion, theology, and their relation to global issues ,  Module 1: Introduction to Ethics in Action,  Module 2: Religion and Virtue Ethics - Part I,  Module 3: Religion and Virtue Ethics - Part II,  Module 4: The Virtuous Society,  Module 5: Poverty and Inequality,  Module 6: Peace,  Module 7: Refugees, Trafficking, and Modern Slavery,  Module 8: Environmental Justice,  Module 9: Politics and Power,  Module 10: Business, Work, and the Common Good,  Course Conclusion: Towards a New Virtue Ethics for Sustainable Development,  Examining Ethics in Action: Case Studies",96,"world s great religious secular philosophies say ethical conduct virtues common across faiths role religious communities play building just sustainable world world s great religious secular philosophies say ethical conduct virtues common across faiths role religious communities play building just sustainable world faith communities can help advance sustainable development working together save common home can done address challenges time developing individuals society good challenges sustainable development technical political  also moral calling us examine human beings want going forward examination makes  good person  called virtue ethics  long purview philosophers theologians world s great religious secular philosophies say ethical conduct virtues common across creeds cultures role ethics spirituality religious communities play sustainable development 2016 distinguished leaders world s major religious traditions philosophers scholars scientists invited pope francis vatican series meetings known ethics action initiative meetings sought promote dialogue find consensus values needed advance transformative action common home human family course features ethics action meeting well leading voices discusses perspectives world s great traditions role addressing world s pressing challenges including poverty corruption climate change presents multi faith cooperation essential achieving sustainable development calls development new shared virtue ethics bring us sustainable peaceful future learn meaning virtue ethics expression several major religious philosophical traditions importance establishing multi faith consensus advance sustainable development importance involving faith communities peace development work ethics motivates actions religious secular leaders politicians scientists civil society business shared virtue ethics needed create peaceful prosperous world everyone challenges sustainable development technical political  also moral calling us examine human beings want going forward examination makes  good person  called virtue ethics  long purview philosophers theologians world s great religious secular philosophies say ethical conduct virtues common across creeds cultures role ethics spirituality religious communities play sustainable development 2016 distinguished leaders world s major religious traditions philosophers scholars scientists invited pope francis vatican series meetings known ethics action initiative meetings sought promote dialogue find consensus values needed advance transformative action common home human family course features ethics action meeting well leading voices discusses perspectives world s great traditions role addressing world s pressing challenges including poverty corruption climate change presents multi faith cooperation essential achieving sustainable development calls development new shared virtue ethics bring us sustainable peaceful future learn religious spiritual communities individuals want contribute work sustainable development development professionals want understand engage local faith communities advanced undergraduates graduate students interested philosophy religion theology relation global issues module 1 introduction ethics action module 2 religion virtue ethics part module 3 religion virtue ethics part ii module 4 virtuous society module 5 poverty inequality module 6 peace module 7 refugees trafficking modern slavery module 8 environmental justice module 9 politics power module 10 business work common good course conclusion towards new virtue ethics sustainable development examining ethics action case studies","world s great religi secular philosophi say ethic conduct virtu common across faith role religi communiti play build just sustain world world s great religi secular philosophi say ethic conduct virtu common across faith role religi communiti play build just sustain world faith communiti can help advanc sustain develop work togeth save common home can done address challeng time develop individu societi good challeng sustain develop technic polit also moral call us examin human be want go forward examin make good person call virtu ethic long purview philosoph theologian world s great religi secular philosophi say ethic conduct virtu common across creed cultur role ethic spiritu religi communiti play sustain develop 2016 distinguish leader world s major religi tradit philosoph scholar scientist invit pope franci vatican seri meet known ethic action initi meet sought promot dialogu find consensus valu need advanc transform action common home human famili cours featur ethic action meet well lead voic discuss perspect world s great tradit role address world s press challeng includ poverti corrupt climat chang present multi faith cooper essenti achiev sustain develop call develop new share virtu ethic bring us sustain peac futur learn mean virtu ethic express sever major religi philosoph tradit import establish multi faith consensus advanc sustain develop import involv faith communiti peac develop work ethic motiv action religi secular leader politician scientist civil societi busi share virtu ethic need creat peac prosper world everyon challeng sustain develop technic polit also moral call us examin human be want go forward examin make good person call virtu ethic long purview philosoph theologian world s great religi secular philosophi say ethic conduct virtu common across creed cultur role ethic spiritu religi communiti play sustain develop 2016 distinguish leader world s major religi tradit philosoph scholar scientist invit pope franci vatican seri meet known ethic action initi meet sought promot dialogu find consensus valu need advanc transform action common home human famili cours featur ethic action meet well lead voic discuss perspect world s great tradit role address world s press challeng includ poverti corrupt climat chang present multi faith cooper essenti achiev sustain develop call develop new share virtu ethic bring us sustain peac futur learn religi spiritu communiti individu want contribut work sustain develop develop profession want understand engag local faith communiti advanc undergradu graduat student interest philosophi religion theolog relat global issu modul 1 introduct ethic action modul 2 religion virtu ethic part modul 3 religion virtu ethic part ii modul 4 virtuous societi modul 5 poverti inequ modul 6 peac modul 7 refuge traffick modern slaveri modul 8 environment justic modul 9 polit power modul 10 busi work common good cours conclus toward new virtu ethic sustain develop examin ethic action case studi",13,0,12,0,"participation_keystems"
"30",50,"evaluation of  public policies and programmes","government","This course is offered by professor Paulo Jannuzzi of the National School of Statistical Sciences (ENCE). The content encompasses evaluation: concepts and types; public policies in Brazil: evolution, scope and scale; technical/political approaches and evaluation public values; process and result maps and programmes; stages in evaluation design; concrete examples of public programme evaluation.
									, This course is offered by professor Paulo Jannuzzi of the National School of Statistical Sciences (ENCE). The content encompasses evaluation: concepts and types; public policies in Brazil: evolution, scope and scale; technical/political approaches and evaluation public values; process and result maps and programmes; stages in evaluation design; concrete examples of public programme evaluation., 
					Target audience
					Civil servants, researchers and students.
				, Civil servants, researchers and students., 
					Learning objectives
					Understand how evaluation instruments can contribute to improve governmental action.
				, Understand how evaluation instruments can contribute to improve governmental action.",188,"course offered professor paulo jannuzzi national school statistical sciences ence content encompasses evaluation concepts types public policies brazil evolution scope scale technical political approaches evaluation public values process result maps programmes stages evaluation design concrete examples public programme evaluation course offered professor paulo jannuzzi national school statistical sciences ence content encompasses evaluation concepts types public policies brazil evolution scope scale technical political approaches evaluation public values process result maps programmes stages evaluation design concrete examples public programme evaluation target audience civil servants researchers students civil servants researchers students learning objectives understand evaluation instruments can contribute improve governmental action understand evaluation instruments can contribute improve governmental action","cours offer professor paulo jannuzzi nation school statist scienc enc content encompass evalu concept type public polici brazil evolut scope scale technic polit approach evalu public valu process result map programm stage evalu design concret exampl public programm evalu cours offer professor paulo jannuzzi nation school statist scienc enc content encompass evalu concept type public polici brazil evolut scope scale technic polit approach evalu public valu process result map programm stage evalu design concret exampl public programm evalu target audienc civil servant research student civil servant research student learn object understand evalu instrument can contribut improv government action understand evalu instrument can contribut improv government action",0,0,4,14,"reflex_adpt_keystems"
"31",51,"extractive sector: sustainability and development in latin america and the caribbean","private university, civil society, un, research  business",NA,NA,NA,NA,NA,NA,NA,NA,NA
"32",52,"feeding a hungry planet","private university, private university, private university, private university, public university, business","How do we create a healthy and sustainable diet for the growing world population? , How do we create a healthy and sustainable diet for the growing world population? , How the field has developed over time, and how recent developments like advanced technology impact farming, , All about regulations influencing production, trade, and other aspects of agriculture, , What is food security? How do poverty, inequality, and other factors affect the nutrition of individuals and entire countries?, , Examples from industries ranging from rice to livestock, and the experiences of smallholder farmers, , Agriculture is more than waving fields of wheat; our ability to grow food from existing natural resources <U+FFFD> and without decimating those resources <U+FFFD> is key to sustainably feeding the world.In this 7-module massive open online course (MOOC), learn about food security worldwide, the effects of malnutrition, how we manage ecosystems that provide food resources, and more. You<U+FFFD>ll emerge from this course with a clear answer to the question: What can I do to make food consumption and production more sustainable?This course is supported by faculty based at Cornell University, Johns Hopkins University, Rothamsted Research, Tufts University, and Wageningen University and Research.We are grateful to the International Fertilizer Association (IFA) for supporting the course's Teaching Assistants., Agriculture is more than waving fields of wheat; our ability to grow food from existing natural resources <U+FFFD> and without decimating those resources <U+FFFD> is key to sustainably feeding the world., In this 7-module massive open online course (MOOC), learn about food security worldwide, the effects of malnutrition, how we manage ecosystems that provide food resources, and more. You<U+FFFD>ll emerge from this course with a clear answer to the question: What can I do to make food consumption and production more sustainable?, , This course is supported by faculty based at Cornell University, Johns Hopkins University, Rothamsted Research, Tufts University, and Wageningen University and Research., We are grateful to the International Fertilizer Association (IFA) for supporting the course's Teaching Assistants., Nutritionists, agriculture professionals, and other practitioners interested in the latest developments in the field, Sustainable development practitioners <U+FFFD><U+FFFD>including those who work for international aid organizations and nonprofits in the realms of poverty, nutrition, and agriculture <U+FFFD> who want to understand the lifecycle of food production and food security , Private actors, such as those engaging in or investing in social entrepreneurship and the support of local agriculture, Graduate students and advanced undergraduate students in agriculture, economics, international development, and other fields who are learning about the intersectional factors impacting agriculture and food production/consumption,  Module 1: The global challenges around food,  Module 2: Agriculture at the center of sustainable development,  Module 3: Food systems for nutritional security and better health,  Module 4: Sustainable intensification of agricultural systems <U+FFFD> Part 1,  Module 5: Sustainable intensification of agricultural systems <U+FFFD> Part 2,  Module 6: Rural development for poverty alleviation,  Module 7: Action for change",112,"create healthy sustainable diet growing world population create healthy sustainable diet growing world population field developed time recent developments like advanced technology impact farming regulations influencing production trade aspects agriculture food security poverty inequality factors affect nutrition individuals entire countries examples industries ranging rice livestock experiences smallholder farmers agriculture waving fields wheat ability grow food existing natural resources   without decimating resources   key sustainably feeding world 7 module massive open online course mooc learn food security worldwide effects malnutrition manage ecosystems provide food resources  ll emerge course clear answer question can make food consumption production sustainable course supported faculty based cornell university johns hopkins university rothamsted research tufts university wageningen university research grateful international fertilizer association ifa supporting course s teaching assistants agriculture waving fields wheat ability grow food existing natural resources   without decimating resources   key sustainably feeding world 7 module massive open online course mooc learn food security worldwide effects malnutrition manage ecosystems provide food resources  ll emerge course clear answer question can make food consumption production sustainable course supported faculty based cornell university johns hopkins university rothamsted research tufts university wageningen university research grateful international fertilizer association ifa supporting course s teaching assistants nutritionists agriculture professionals practitioners interested latest developments field sustainable development practitioners   including work international aid organizations nonprofits realms poverty nutrition agriculture   want understand lifecycle food production food security private actors engaging investing social entrepreneurship support local agriculture graduate students advanced undergraduate students agriculture economics international development fields learning intersectional factors impacting agriculture food production consumption module 1 global challenges around food module 2 agriculture center sustainable development module 3 food systems nutritional security better health module 4 sustainable intensification agricultural systems   part 1 module 5 sustainable intensification agricultural systems   part 2 module 6 rural development poverty alleviation module 7 action change","creat healthi sustain diet grow world popul creat healthi sustain diet grow world popul field develop time recent develop like advanc technolog impact farm regul influenc product trade aspect agricultur food secur poverti inequ factor affect nutrit individu entir countri exampl industri rang rice livestock experi smallhold farmer agricultur wave field wheat abil grow food exist natur resourc without decim resourc key sustain feed world 7 modul massiv open onlin cours mooc learn food secur worldwid effect malnutrit manag ecosystem provid food resourc ll emerg cours clear answer question can make food consumpt product sustain cours support faculti base cornel univers john hopkin univers rothamst research tuft univers wageningen univers research grate intern fertil associ ifa support cours s teach assist agricultur wave field wheat abil grow food exist natur resourc without decim resourc key sustain feed world 7 modul massiv open onlin cours mooc learn food secur worldwid effect malnutrit manag ecosystem provid food resourc ll emerg cours clear answer question can make food consumpt product sustain cours support faculti base cornel univers john hopkin univers rothamst research tuft univers wageningen univers research grate intern fertil associ ifa support cours s teach assist nutritionist agricultur profession practition interest latest develop field sustain develop practition includ work intern aid organ nonprofit realm poverti nutrit agricultur want understand lifecycl food product food secur privat actor engag invest social entrepreneurship support local agricultur graduat student advanc undergradu student agricultur econom intern develop field learn intersect factor impact agricultur food product consumpt modul 1 global challeng around food modul 2 agricultur center sustain develop modul 3 food system nutrit secur better health modul 4 sustain intensif agricultur system part 1 modul 5 sustain intensif agricultur system part 2 modul 6 rural develop poverti allevi modul 7 action chang",2,1,1,1,"participation_keystems"
